IMDB_ID,movie_name,Year,Released,Actors,Director,Writers,Genre,Production,IMDB_Rating,Language,Plot,IMDB_votes,MetaCritic,Rotten Tomatoes,Runtime,Box_Office,Type
tt1941638,Sadda Adda,2011,13-Jan-12,"Karan Sharma, Shaurya Chauhan, Bhaumik Sampat, Kadambari Jethwani",Muazzam Beg,Muazzam Beg,"Comedy, Drama, Romance",N/A,7.2,Hindi,"'The only thing that will stop you from fulfilling your dreams is you"" People have dreams, but not all of us have the guts to put faith in ourselves. Most of us lose focus and give up. We ...","1,139",N/A,,130 min,N/A,movie
tt6080232,Bole India Jai Bhim,2016,07-Oct-16,"Shyam Bhimsaria, Jeetendra Doshi, Dhananjay Galani, Nataliya Kozhenova",Subodh Nagdeve,Subodh Nagdeve,Biography,N/A,N/A,Marathi,The movie is a biopic which portrays the life and works of Hardas Laxmanrao Nagrale popularly known as Babu Hardas. He was an ardent follower of Dr. Babasaheb Ambedkar and a Dalit Social Reformer.,N/A,N/A,,150 min,N/A,movie
tt2404187,Bloody Isshq,2013,01-Mar-13,"Akash, Shilpa Anand, Karan Veer Mehra, Tripta Parashar",Arup Dutta,Aroti Bhattacharya,Romance,N/A,8,Hindi,The story revolves around the three characters and showcases the love trap which Nirvaan throws for Natasha hiding the fact that he is married to Radhika. The love mystery unravels as destiny has something else planned for Nirvaan.,20,N/A,,N/A,N/A,movie
tt3426144,Babloo Happy Hai,2014,07-Feb-14,"Sahil Anand, Parvin Dabas, Erica Fernandes, Preet Kamal",Nila Madhab Panda,"Sanjay Chauhan, Protiqe Mojoomdar (lyricist), Deepak Venkatesha (additional screenplay & dialogue)","Comedy, Drama, Romance",N/A,6.8,Hindi,"Jatin, Harry and Rohan head to Manali for one last trip before Jatin gets married. In Manali, the group of friends meet Natasha and are set forward on a journey of rediscovery.",71,N/A,,113 min,N/A,movie
tt8067016,,,,,,,,,,,,,,,,,
tt4554354,Hotel Beautifool,2015,N/A,"Rajith Menon, Brijendra Kala, Johnny Lever, Imam Siddique",Sameer Iqbal Patel,Sameer Iqbal Patel,Comedy,N/A,N/A,Hindi,"Hotel Beautiful is everything except what it claims to be. Once a pearl of Goa beach this Gallic structure, is now a joke of Hospitality Industry. Here chaos is on the menu and confusion is...",N/A,N/A,,130 min,N/A,movie
tt5760490,Fredrick,2016,27-May-16,"Avinash Dhyani, Prashant Narayanan, Tulna Butalia, Anna Ador",Rajesh Butalia,Rajesh Butalia,"Action, Thriller",N/A,5.6,Hindi,A suspended cop and his wife try to find out his sister when he gets caught in a human trafficking nexus. But the mastermind behind this is someone unknown to everyone.,9,N/A,,129 min,N/A,movie
tt4232066,Once Again,2015,N/A,N/A,Kanwal Sethi,Kanwal Sethi,Romance,N/A,N/A,N/A,N/A,N/A,N/A,,N/A,N/A,movie
tt3881136,Life Is Beautiful,2014,22-Aug-14,"Manoj Amarnani, Nancy Brunetta, Anokhi Dalvi, Parth Naik",Manoj Amarnani,"Manoj Amarnani, Sanjay Sankla","Comedy, Romance",N/A,5,Hindi,"Raj works in Toronto and lives with his friend Prem who hates him for invading his tiny apartment. After Raj's application for Canadian residency is rejected, he plots the perfect plan to ...",39,N/A,,N/A,N/A,movie
tt0811613,Meridian Lines,2013,31-May-13,"Arjun Rampal, Irrfan Khan, Konkona Sen Sharma, Raima Sen",Venod Mitra,"Anurag Kashyap (dialogue translation), Venod Mitra (screenplay)",Drama,N/A,7.1,"Hindi, Hindi",A poor road worker sets off a chain of events that bring karmic balance to seven very troubled strangers. KARMAYA simplifies the complexities of the karmic mechanisms that bind present ...,75,N/A,,N/A,N/A,movie
tt7766238,,,,,,,,,,,,,,,,,
tt6506096,BUCHCHA,2017,N/A,"Dharmendra Ahirwar, Yashvardhan Singh, Shabana Afrin, Puja Bharti",Shirsh Shanti Prasidh,N/A,Drama,N/A,N/A,Hindi,N/A,N/A,N/A,,80 min,N/A,movie
tt1657293,Kutty Pisasu,2010,07-May-10,"Ramya Krishnan, Sangeetha, Kaveri, Keerthika Baby",Ramanarayanan,Ravi K. Kiran (dialogue),"Animation, Drama, Fantasy",N/A,5.5,"Tamil, Telugu, Kannada, Hindi, Bhojpuri, English","After a Goddess withdraws her protection, a child becomes possessed by a vengeful deceased woman.",12,N/A,,145 min,N/A,movie
tt1725798,Be-Careful,2011,21-Oct-11,"Asrani, Ali Khan, Bobby Khan, Hemant Pandey",Chandrakant Singh,"Mohammed Salim (story, screenplay, dialogue)","Comedy, Crime, Drama",N/A,3.1,"Hindi, Panjabi, English","In a bid to escape their domineering wives, two womanizing slackers get saddled with a corpse amongst other challenges in a foreign country.",72,N/A,,N/A,N/A,movie
tt2830226,Oonga,2013,03-May-13,"Raju Singh, Seema Biswas, Priyanka Bose, Nandita Das",Devashish Makhija,"Harish Amin (screenplay), Devashish Makhija (dialogue), Devashish Makhija (screenplay), Devashish Makhija (story), Sarat Talluri Rao (story)","Adventure, Drama",N/A,7,"Hindi, Oriya","Little tribal boy runs off on a long journey to the big city to watch the Ramayana that his friends saw but he missed, unaware that his little village is being forced to give up its land for bauxite mining.",43,N/A,,98 min,N/A,movie
tt6363228,Part Time Job,2016,N/A,"Sonu Choudhary, Aaryan Maheshwari, Kanyalata Panchal",N/A,Hriday Shankar,Drama,N/A,N/A,Hindi,N/A,N/A,N/A,,105 min,N/A,movie
tt7997334,,,,,,,,,,,,,,,,,
tt4121522,Shuruaat Ka Interval,2014,15-Aug-14,"Avidant Bhagat, Kaivalya Chheda, Rajsekhar Aningi, Bramha","Aarti S. Bagdi, Amrit Raj Gupta, Krishan Hooda, Shishir Jha, Atanu Mukherjee, Rukshana Tabassum, Ankit Tripathi, Palash Vaswani","Aarti S. Bagdi, Amrit Raj Gupta, Krishan Hooda, Shishir Jha, Atanu Mukherjee, Biswapati Sarkar, Rukshana Tabassum, Ankit Tripathi, Palash Vaswani, Gautam Ved",N/A,N/A,7.6,Hindi,"An anthology of 8 short films around the theme of ""Interval"", mentored and curated by Imtiaz Ali, Vikas Bahl, Vikramaditya Motwane and Anand Gandhi.",51,N/A,,99 min,N/A,movie
tt3056632,Manjunath,2014,09-May-14,"Anjori Alagh, Karan Ashar, Aarun D. Baliean, Asif Basra",Sandeep A. Varma,"Nitin Dwivedi, Sandeep A. Varma","Biography, Drama",N/A,7.2,"Hindi, Hindi","'Manjunath' is a warm inspirational film based on the true story of Manjunath Shanmugam, a sales officer from a petroleum company who was killed by the oil mafia in 2005 for his stand against fuel adulteration.",433,N/A,,130 min,N/A,movie
tt3267464,Kaphal: Wild Berries,2013,01-Oct-13,"Hema Bisht, Ramkishan Choyal, Subrat Dutta, Gita Guha",Batul Mukhtiar,"Batul Mukhtiar (story), Batul Mukhtiar, Batul Mukhtiar, Vivek Shah","Action, Adventure, Drama",N/A,N/A,Hindi,"Two boys try to send their strict father back to the city with the help of the forest witch, but instead get taken for a merry ride by her granddaughter.",N/A,N/A,,90 min,N/A,movie
tt2527256,My Cornerstone,2013,12-Jun-13,"Zenia Starr, Romin Khan, James Morcan, Savita Starr",Stanley Joseph,"Stanley Joseph (story), James Morcan (screenplay)","Comedy, Drama, Romance",N/A,6.8,"English, Hindi",A young Indian nurse moves to Sydney where she's placed in the household of a wealthy Indian-Australian family and given the task of caring for an elderly lady.,25,N/A,,119 min,N/A,movie
tt2218228,The Bright Day,2015,22-Oct-15,"Mohan Agashe, Radhika Apte, Rajit Kapoor, Rakhi Kumari",Mohit Takalkar,"Varun Narvekar, Mohit Takalkar, Mohit Takalkar (story), Pradeep Vaiddya",Drama,N/A,6,Hindi,"This is a story of Shiv. Shiv, with a supportive family, a close group of friends and a normal life in all respects, sets out on a journey to discover what he seeks in the outside world, ...",106,N/A,,90 min,N/A,movie
tt1649760,The Film Emotional Atyachar,2010,03-Sep-10,"Ranvir Shorey, Vinay Pathak, Ravi Kishan, Mohit Ahlawat",Akshay Shere,"Amitabh Bhattacharya (lyrics), Bhavini Bheda, Rakshit Dahiya (concept by), Rakshit Dahiya (original concept), Kartik Krishnan (dialogues), Virag Mishra (lyrics)","Comedy, Crime, Drama",N/A,6.1,"Hindi, Gujarati, English",A businessman runs into corrupt police officers and gangsters after procuring a bag full of cash,268,N/A,,87 min,N/A,movie
tt2283894,Riyasat,2014,18-Jul-14,"Rajesh Khanna, Aryeman Ramsay, Raza Murad, Aryan Vaid",Ashok Tyagi,N/A,Crime,N/A,6.5,Hindi,Riyasat is a story about the much loved Sahab played by the late Rajesh Khanna. Sahab has ruled for many years and has established his kingdom. People look up to him for everything. He has ...,37,N/A,,80 min,N/A,movie
tt2112978,Jo Hum Chahein,2011,16-Dec-11,"Sunny Gill, Simran Kaur Mundi, Alyy Khan, Achint Kaur",Pawan Gill,"Pawan Gill, Rashmi Kulkarni (dialogue)","Drama, Romance",N/A,5.3,"Hindi, Panjabi, English","In his bid to quickly boost his career, a male alienates himself from his family, friends, and true love.",88,N/A,,N/A,N/A,movie
tt1754137,Little Terrors,2014,12-Sep-14,"Om Puri, Deep Dhillon, Aamrik Arjun, Armaan Kabli",Maninder Chana,Maninder Chana,Drama,N/A,7.5,"Hindi, Urdu, English","A 13-year-old American boy is recruited by terrorists to bomb a U.S. embassy in Delhi. After being brainwashed he is sent to live with a Muslim family prior to the attack. However, the man ...",65,N/A,,103 min,N/A,movie
tt2222716,Baat Bann Gayi,2013,11-Oct-13,"Anisa Butt, Ali Fazal, Gulshan Grover, Razzak Khan",Shuja Ali,"Shuja Ali, Akshay Singh","Comedy, Romance",N/A,5.4,Hindi,N/A,53,N/A,,N/A,N/A,movie
tt2253708,Future to Bright Hai Ji,2012,02-Nov-12,"Sanjay Amar, Asrani, Neelima Azim, Aamir Bashir",Sanjay Amar,Sanjay Amar,Drama,N/A,6.3,Hindi,N/A,70,N/A,,N/A,N/A,movie
tt6026722,The Buddhist Monk,2016,12-Aug-16,"Deachen Angmo, Shantanu Arora, Sidharth Bhardwaj, Abbas Haider","Rattan Mann, Usha Singh",Rattan Mann,"Adventure, Crime, Drama",N/A,N/A,"Hindi, Hindi","Inspired by true events, this is the story of one man's personal battle between right and wrong, his devotion to his country and his love for his wife. When a poor farmer takes his ill wife...",N/A,N/A,,130 min,N/A,movie
tt7884788,,,,,,,,,,,,,,,,,
tt2207668,Chakradhaar,2012,15-Jun-12,"Abishek Anand, Zakir Hussain, Darshan Jariwala, Vidya Malvade","Dharam Prakash, Shakur Sir","Dharam Prakash, Arsh Rana","Action, Crime, Drama",N/A,4.4,Hindi,"Shravan, a student, gets embroiled in the world of crime, after he is falsely accused of murdering his principal Shrivastav. He then decides to fight back for justice and change in the society, thus becoming 'Pandit' from 'Shravan'.",23,N/A,,120 min,N/A,movie
tt7769346,Ekkees Tarikh Shubh Muhurat,2018,N/A,"Sanjay Mishra, Kamalika Banerjee, Mukesh Tiwari, Brijendra Kala",Pavan Kumar,Pavan Kumar,Drama,N/A,N/A,Hindi,N/A,N/A,N/A,,97 min,N/A,movie
tt6081620,Life Ki Aisi Ki Taisi,2016,N/A,"Mushtaq Khan, Sunil Pal, Rocky Verma, Javed Hyder",Ejaz Ahmed,"Ejaz Ahmed (story), Uddeept (story)",Comedy,N/A,N/A,Hindi,It's a Satirical Comedy Movie of Today's Society. Message With Fun.,N/A,N/A,,130 min,N/A,movie
tt1629424,Trump Card,2010,12-Mar-10,"Vikrum Kumar, Haidar Ali, Urvashi Chaudhary, Mansi Dovhal",Arshad Khan,"Arshad Khan (screenplay & dialogue), Yawer Rehman (screenplay & dialogue), Yawer Rehman (script)","Action, Drama, Mystery",N/A,2.8,"Hindi, Marathi, English",Three friends find their lives endangered after a huge inheritance.,14,N/A,,N/A,N/A,movie
tt5001454,Dream Lock,2015,N/A,"Nikkesha, Dhavall Pujara, Faisal Sayed, Poonam A. Sirnaik",Vishal Raj,"Mohammed Irfan, Vishal Raj","Drama, Mystery, Thriller",N/A,N/A,Hindi,Over the course of three dreams a man foresee events about to occur not realizing his ability to influence a physical activity without physical interaction.,N/A,N/A,,N/A,N/A,movie
tt8032752,,,,,,,,,,,,,,,,,
tt1594964,Chase,2010,30-Apr-10,"Anuj Saxena, Udita Goswami, Tarina Patel, Sameer Kochhar",Jag Mundhra,"Abhiram Bhadkamkar (additional screenplay & dialogue), Tanveer Khan (script)","Action, Crime, Drama",N/A,4.8,"Hindi, Marathi, English",Police launch a manhunt for an escaped rehab-patient/terrorist responsible for the assassination of a politician,84,N/A,,103 min,N/A,movie
tt7725824,Taapmaan,2018,02-Mar-18,Prashast Singh,Prashast Singh,"Prashast Singh (dialogue), Prashast Singh (screenplay), Prashast Singh (story)","Action, Drama",Prashast Singh Presentations,N/A,Hindi,"Partially inspired by true events, the film revolves around an independent filmmaker whose constant struggles to establish himself as a filmmaker form the base of the film.",N/A,N/A,,70 min,N/A,movie
tt5525846,Yeh Hai India,2017,18-Aug-17,"Mohan Agashe, Antara Banerjee, Jan Bostock, Gavie Chahal",Lom Harsh,Lom Harsh,"Action, Adventure, Drama",N/A,N/A,Hindi,"Yeh Hai India, follows the story of a 25 years old NRI, who is born and brought up in UK. He shares the same stereotypical views about India that most NRIs have and how his perception changes.",N/A,N/A,,N/A,N/A,movie
tt6094164,Idgah,2016,N/A,"Shabana Azmi, Ziya Azazi, Yohaan Panjuani","Piyush Panjuani, Piyush Panjuani",Piyush Panjuani,"Drama, Family",N/A,N/A,Hindi,Relationships reach greater depths through small gestures and simple acts driven by innocence. 'IDGAH' is an emotive journey between a grandmother and her grandson. It's a beautiful ...,N/A,N/A,,77 min,N/A,movie
tt3790250,Ishq Sarfira,2015,27-Nov-15,"Naina Aswal, Himesh Choudhary, Rajkumar Kanojia, Abdul Khaan",N/A,Vijay Basu,"Action, Thriller",N/A,5.8,"Hindi, Tamil",It is a kind of Realistic story which happened in Delhi long before between the gangsters in there.,10,N/A,,N/A,N/A,movie
tt4231836,Pocket Gangsters,2015,03-Jan-15,"Mukesh Bhatt, Shivangi Mehra, Madhur Mittal, Vijay Raaz",Hemant Nilim Das,Hemant Nilim Das (original screenplay and dialogue),Thriller,N/A,N/A,Hindi,how real you can fake yourself?,N/A,N/A,,110 min,N/A,movie
tt7118514,,,,,,,,,,,,,,,,,
tt8096956,,,,,,,,,,,,,,,,,
tt2613766,Tere Ishq Nachaya,2010,01-Jan-10,"Kanwaljit Singh, Deep Dhillon, Mannat Singh, Gavie Chahal",Ravinder Ravi,Ravinder Ravi,Romance,Pearls Group,N/A,Hindi,"Kamal is a spoiled, selfish young woman with a grandiose sense of entitlement and the maturity of a four year old. She lives with her father and uncles, and has never heard the word no. ...",N/A,N/A,,122 min,N/A,movie
tt6851664,Romeo N Bullet,2017,14-Apr-17,N/A,Aditya Kumar,"Aditya Kumar (screenplay writer,  Dialogue writer), Vishal V. Patil (dialogue writer), RajKumar (story)",Drama,N/A,N/A,Hindi,N/A,N/A,N/A,,116 min,N/A,movie
tt7060038,,,,,,,,,,,,,,,,,
tt1869759,The Train,2011,27-May-11,"Mammootty, Sheena Chohan, Sabitha Jayaraaj, Jayasurya",Jayaraaj,Jayaraaj,Drama,N/A,4.5,"Malayalam, Hindi, Tamil",N/A,103,N/A,,N/A,N/A,movie
tt7104898,Afghan: in Search of a Home,2018,N/A,Adnan Sami,"Radhika Rao, Vinay Sapru","Radhika Rao, Vinay Sapru",Drama,N/A,N/A,Hindi,"In a present day war torn Afghanistan, an Afghan musician flees his country under tense circumstances and seeks refuge in India where he finds love in more ways than one. The movie ...",N/A,N/A,,N/A,N/A,movie
tt7282370,Who,2017,06-Dec-17,"Shine Tom Chacko, Pearle Maaney, Sruthi Menon, Prasanth Nair",Ajay Devaloka,Ajay Devaloka,Mystery,N/A,N/A,"Malayalam, Hindi",N/A,N/A,N/A,,120 min,N/A,movie
tt1955036,Vakratunda Mahakaaya,2013,28-Jul-13,"Vijay Maurya, Naman Jain, Usha Nadkarni, Mukesh Chhabra",Punarvasu Naik,Yogesh Vinayak Joshi,Comedy,N/A,6.9,"Marathi, Hindi",N/A,7,N/A,,N/A,N/A,movie
tt2691010,Mumbai 125 KM 3D,2014,17-Oct-14,"Karanvir Bohra, Vedita Pratap Singh, Veena Malik, Joe Debroy",Hemant Madhukar,Hemant Madhukar,"Adventure, Horror, Mystery",N/A,2.9,Hindi,"On their way to a New Year's Eve party in Mumbai, a group of five friends encounter supernatural occurrences on a highway, 125 kilometres outside the city.",137,N/A,,100 min,N/A,movie
tt5899800,Lagna Pahave Karun,2013,04-Oct-13,"Umesh Kamat, Mukta Barve, Siddharth Chandekar, Tejashree Pradhan",Ajay Naik,"Ajay Naik, Kshitij Patwardhan",Romance,N/A,N/A,Hindi,"Lagna Pahave Karun is a film that talks about Love, Relationships and Marriage as an institution.",N/A,N/A,,125 min,N/A,movie
tt5085386,Mahesh Dattani's Hasmukh Saab ki Wasihat,2015,27-Feb-15,"Mohan Agashe, Seema Bhargava, Achint Kaur, Gagan Singh Sethi",Mahesh Dattani,Mahesh Dattani,Drama,N/A,6.6,Hindi,"Hasmukh Saab Ki Wasihat is the story of a rich, autocratic businessman who doesn't relinquish control of his family even after his death. He tries to control them through his will, however he is in for a surprise.",25,N/A,,82 min,N/A,movie
tt2306721,Second Marriage Dot Com,2012,20-Aug-12,"Subhash Ahuja, Syna Anand, Raman Atre, Rajat Bhalla",Gaurav Panjwani,"Gaurav Panjwani (story), Dinkar Sharma (screenplay)",Drama,N/A,7.4,Hindi,"Akshay, young IT professional from Delhi; only child of a single parent Suneel Narang embarks on a journey to get his father, a widower; married so to finally put an end to his prolonged ...",47,N/A,,130 min,N/A,movie
tt5963796,For Bindiya Call Jugnu,2016,N/A,"Meghna Naidu, Razak Khan, Anupam Shyam, Amit Sial",N/A,Arjun Bagga,Drama,N/A,N/A,Hindi,N/A,N/A,N/A,,84 min,N/A,movie
tt4620544,Robinhood Ke Pote,2016,N/A,"Rajat Barmecha, Anshuman Jha, Shadab Kamal, Cherry Mardia",Pradeep Singrole,Pradeep Singrole,Drama,N/A,N/A,Hindi,N/A,N/A,N/A,,N/A,N/A,movie
tt6672208,,,,,,,,,,,,,,,,,
tt5914630,Chudail Story,2016,13-May-16,"Pankaj Berry, Sunny Charles, Menka Lalwani, Nidhi Nautiyal",Surya Lakkoju,"Surya Lakkoju (script), Surya Lakkoju (story)",Horror,N/A,2.9,Hindi,A seductive witch kills men by casting a spell on them. A bunch of friends are trapped in a haunted house with mysterious lady. Is she the Chudail?,77,N/A,,100 min,N/A,movie
tt6855200,Perfect Plan,2017,26-May-17,"Yusuf Qasmi, Raza Murad, Zeeshan Khan, Pallavi Shetty",Yusuf Qasmi,"Amol Kasliwal, Yusuf Qasmi","Drama, Mystery, Thriller",N/A,N/A,Hindi,Jhanvi and Veer were married and living happily with each other. Jhanvi was very fond of reading novels and the hangover is so high that she sees the characters of the novels in her dream. ...,N/A,N/A,,127 min,N/A,movie
tt5351378,Good Morning Sunshine,2016,N/A,"Shabana Azmi, Shweta Tripathi, Revathy, Rituparna Sengupta",Sanjoy Nag,Sanjoy Nag,Drama,N/A,N/A,"English, Hindi",N/A,N/A,N/A,,N/A,N/A,movie
tt7509426,,,,,,,,,,,,,,,,,
tt4364998,Solid Patels,2017,N/A,"Shiv Pandit, Shazahn Padamsee, Kettan Singh, Ali Asgar",Saurabh Varma,Rahul Patel,Comedy,N/A,N/A,Hindi,"Tom Patel and Jerry Patel. These Patel boys are no less than real life animated characters themselves. They live together in a rented apartment in Mumbai, and have no specific jobs. Both ...",N/A,N/A,,N/A,N/A,movie
tt8029126,,,,,,,,,,,,,,,,,
tt3526430,After the Third Bell,2014,04-Apr-14,"Udayan Banerjee, Akanksha D. Sharma, Sukhesh Arora, Sameer Thakur",Ajay Govind,Ajay Govind,"Crime, Mystery",TheMovieKaka,6.7,"English, Hindi",The death of an actor in front of a live audience leads to an investigation where the officer in charge seems more distracted by his prejudices towards the suspects than the merits of the case.,27,N/A,,92 min,N/A,movie
tt6154834,Lashtam Pashtam,2017,N/A,"Om Puri, Tisca Chopra, Priyanshu Chatterjee, Ishita Dutta",Manav Bhalla,"Manav Bhalla (story), Nitin Keswani (screenplay), Nitin Keswani (story)",Drama,N/A,N/A,Hindi,N/A,N/A,N/A,,N/A,N/A,movie
tt3380190,Ek Tha Hero,2016,N/A,"Ayush Mahesh Khedekar, Asrani, Ashwini Kalsekar, Amita Pathak",Yogesh Pagare,Yogesh Pagare,"Drama, Family",N/A,N/A,Hindi,EK THA HERO is an inspiring story of a 11 year old village boy fondly called as HERO who has a passion for CYCLE & dreams of having his own CYCLE someday. He has to go through a roller ...,N/A,N/A,,121 min,N/A,movie
tt4995402,Bumper Draw,2015,16-Oct-15,"Seema Azmi, Narendra Bedi, Reena Charnya, Bomie E. Dotiwala",Irshad Khan,Rashid Khan,Comedy,Blackstone Entertainment,4.8,Hindi,"Sunderlal and Farooq who befriend each other in a strange situation. After which, they both encounter Pestonji, an old Parsi man who adds to their existing list of problems.",25,N/A,,130 min,N/A,movie
tt2180283,Delinquent Dancers,2012,30-Nov-12,"Akhilesh, Sulabha Arya, Sanket Farad, Santosh Juvekar",Samit Kakkad,"Jha Bhalchandra, Sachin Dharekar, Hemant Edlabadkar, Samit Kakkad, Rajesh Kushte, Pradeep Rane, Suchita Sawant",Music,N/A,6,"Marathi, Hindi","We dance for laughter, We dance for tears, We dance for madness, We dance for fears, We dance for hopes, We dance for screams, We are the dancers, We create the dreams.",41,N/A,,94 min,N/A,movie
tt2014409,Zara sambhal ke,2013,19-Jul-13,"Yoggitta Dandaykar, Esshan Khan, Mohini Nillakant, Sunita Rao",N/A,Masud Mirza,Drama,N/A,N/A,Hindi,N/A,N/A,N/A,,115 min,N/A,movie
tt7182050,,,,,,,,,,,,,,,,,
tt4309284,The Silent Heroes,2015,11-Dec-15,"Mann Bagga, Gurfareen Bano, Maanuv Bharadwaj, Tarun Bhargawa",N/A,"Mahesh Bhatt (story), Mahesh Bhatt, Rituraj Bhatt","Adventure, Drama, Family",N/A,6.4,"Hindi, Hindi","The story of 13 Real deaf children and their heroism, passion and humanity.",46,N/A,,115 min,N/A,movie
tt7127992,The Dream Job,2017,11-Aug-17,"Sadhvi Bhatt, Zuber k Khan, Prasad Shikhare, Vikas Shrivastav",Mukesh Mishra,N/A,Drama,N/A,7.8,Hindi,N/A,6,N/A,,138 min,N/A,movie
tt5216794,Lakme,2016,07-Jan-16,"Rayya Labib, Prince, S.A. Rashid",Sanjay Khandelwal,Devendra Kishor,Romance,N/A,N/A,Hindi,N/A,N/A,N/A,,110 min,N/A,movie
tt1867064,Strings of Passion,2014,17-Jan-14,"Zeenat Aman, Indrani Haldar, Avalok Nagpal, Rajesh Sharma",Sanghamitra Chaudhuri,Sanghamitra Chaudhuri,Drama,N/A,7.3,"Hindi, Bengali",Three college friends share their recent developments in their respective lives after three years of separation.,25,N/A,,100 min,N/A,movie
tt4714202,Ramad,2015,N/A,"Kumar Vaibhav, Kuldeep Sharma, Meenakshi Thapa, Sourabh Arora","Shankar Addi Mehra, Waseem Waseem Mushtaq","Shankar Addi Mehra (story), Shankar Addi Mehra","Comedy, Drama, Thriller",N/A,N/A,Hindi,NOTHING IS LOST OR WASTED IN THIS LIFE,N/A,N/A,,142 min,N/A,movie
tt8259696,,,,,,,,,,,,,,,,,
tt2332570,The Lost Tape,2012,14-Sep-12,"Ankuar Panchal, Esha Rajee, Monali Sehgal, Shaurya Singh",Rakshit Dahiya,N/A,"Adventure, Horror",N/A,6.4,Hindi,"Five youngsters went into the woods of Chail, Himachal Pradesh to explore an old urban legend's story. They were completely unaware of the fact that they were slowly becoming part of the ...",7,N/A,,N/A,N/A,movie
tt3729924,Black Home,2015,10-Apr-15,"Ashutosh Rana, Chitrashi Rawat, Murli Sharma, Simran Sehmi",Ashish Deo,"Ashish Deo (dialogue), Ashish Deo (screenplay), Ashish Deo (story)","Drama, Thriller",N/A,7.8,Hindi,"Rajawadi Remand Home is in lot of controversy because of many illegal activities. DK, a news channel bureau chief wants to bring the facts out but the system is not so easy to expose.",16,N/A,,105 min,N/A,movie
tt7688918,,,,,,,,,,,,,,,,,
tt2198132,Rangdari,2012,N/A,"Gaurav Chopra, Kajal Yadav, Manjul Aasim, Alankrita Sahai",Avinash Abhimanyu,"Ikram Akhtar, Sanjay Masoom",Action,N/A,7.4,Hindi,Rangdari captures the enigma and mystery in a raw visual format that depicts the life and times of one...,5,N/A,,N/A,N/A,movie
tt7198366,,,,,,,,,,,,,,,,,
tt2112335,Who's There?,2011,18-Nov-11,"Rana Jung Bahadur, Hemant Birje, Gagan Kang, Mushtaq Khan","Ejaz Ahmed, Ahmed Ejaz","Ejaz Ahmed (screenplay), Ahmed Ejaz (screenplay), Shakir Shaikh (story)","Horror, Thriller",True Dreams,3.3,Hindi,Its a horror suspense love story about new wadding couple.,6,N/A,,130 min,N/A,movie
tt1679290,Shuttlecock Boys,2011,03-Aug-12,"Aakar Kaushik, Manish Nawani, Alok Kumar, Vijay Prateek",Hemant Gaba,Hemant Gaba (screenplay),"Comedy, Drama",N/A,6,Hindi,"Shuttlecock Boys - Story of Entrepreneurship Dream, is a heart warming tale of 4 boys from Delhi who play badminton in the night in their neighborhood. These boys who come from humble ...",102,N/A,,76 min,N/A,movie
tt1674757,The Way Home,2011,19-Aug-11,"Prithviraj Sukumaran, Indrajith, Govardhan, Uday Chandra",Bijukumar Damodaran,"Bijukumar Damodaran, Biju Kumar","Drama, Family",N/A,6.6,"Malayalam, Hindi","The plot revolves around a doctor with a haunting past. Now working at a Prison Hospital, the Doctor is assigned the case of a woman a surviving member from a notorious terrorist group. ....",122,N/A,,95 min,N/A,movie
tt1506994,Woman from the East,2013,N/A,"Satwant Bal, Chhotu, Dharmu, Hardeep Gandhi",Jeet Matharru,Jatinder Brar,"Drama, Family",N/A,6.3,Hindi,A hard hitting realistic film on human exploitation issues in the underbelly of rural India.,6,N/A,,120 min,N/A,movie
tt1921071,Queens! Destiny of Dance,2011,29-Apr-14,"Seema Biswas, Vineeth",David Atkins,David Atkins,"Drama, Musical",N/A,4.2,Hindi,"Mukta is a transgender. He/she is the best dancer in a dedicated Indian palace community. Mukta is a natural leader whom all the other transgender dancers look up to. That is until Nandini,...",6,N/A,,112 min,N/A,movie
tt1740017,Payback,2010,26-Nov-10,"Gulshan Grover, Munish Khan, Zakir Hussain, Mukesh Tiwari",Sachin P. Karande,"Upendra Sidhaye, Dev Sikandar (lyrics)","Action, Crime, Drama",BIGFlix,5.3,"Hindi, Marathi, English",A man decides to re-pay a good Samaritan but regrets doing so after he finds out that he is an assassin.,60,N/A,,115 min,N/A,movie
tt1773774,The Untitled Kartik Krishnan Project,2010,31-Oct-10,"Swara Bhaskar, Vishwesh Krishnamoorthy, Kartik Krishnan, D. Santosh",Srinivas Sunderrajan,"Vijesh Rajan, Srinivas Sunderrajan","Drama, Mystery, Sci-Fi",N/A,6.5,"English, Hindi","In a bustling office in Mumbai, Kartik Krishnan sits behind his desk coding HTML websites when he chances upon a blog on cinema featuring Independent filmmakers. This sparks his intentions ...",50,N/A,,75 min,N/A,movie
tt7152802,,,,,,,,,,,,,,,,,
tt5780570,A Scandall,2016,24-Jun-16,"Johnny Baweja, Reeth Mazumder, Manav Kaul, Puru Chibber",Ishaan Trivedi,Ishaan Trivedi,Thriller,N/A,4.4,Hindi,"Kuhu, a 9 year old girl, drowns in a lake in Nainital. Soon after, her father, Manav falls off a cliff but lives on to lead a strange life of hallucinations and complete metamorphosis. ...",83,N/A,,112 min,N/A,movie
tt4930160,I Am Mr Mother,2015,14-Aug-15,"Mehul Adwani, Dheeraj Bishnoi, Munmun Guha, Kuldip Singh Khalsa",I.A. Siddique,I.A. Siddique,"Drama, Romance",N/A,5.8,Hindi,N/A,20,N/A,,90 min,N/A,movie
