IMDB_ID,movie_name,Year,Released,Actors,Director,Writers,Genre,Production,IMDB_Rating,Language,Plot,IMDB_votes,MetaCritic,Rotten Tomatoes,Runtime,Box_Office,Type
tt2122340,Ferrari Ki Sawaari,2012,15-Jun-12,"Sharman Joshi, Boman Irani, Ritwik Sahore, Paresh Rawal",Rajesh Mapuskar,"Vidhu Vinod Chopra (original story and screenplay), Rajesh Mapuskar (original story and screenplay), Rajkumar Hirani (original story and dialogue), Shekhar Dhavalikar (script associate), Ranjeet Bahadur (dialogue associate)","Comedy, Drama, Family",Eros Entertainment,6.4,Hindi,How the pursuit of an Indian cricket legend's Ferrari makes a young boy's dreams of playing cricket at Lords a reality.,"4,256",N/A,,140 min,"$420,046",movie
tt3531852,Bhoothnath Returns,2014,11-Apr-14,"Amitabh Bachchan, Boman Irani, Parth Bhalerao, Sanjay Mishra",Nitesh Tiwari,"Piyush Gupta, Shreyas Jain (additional script writer), Nikhil Mehrotra (additional script writer), Nitesh Tiwari","Comedy, Drama, Fantasy",B4U US,6.8,Hindi,"A ghost returns back from his world to prove something. But on earth, he has something more to do for his country.","4,005",N/A,,155 min,N/A,movie
tt2876408,Mr Joe B. Carvalho,2014,03-Jan-14,"Arshad Warsi, Soha Ali Khan, Naatak Amaan, Rajesh Balwani",Samir Tewari,"Mahesh Ramchandani, Arshad Sayyad",Comedy,N/A,3.7,Hindi,A small time detective is hired to bring back the daughter of a businessman who has run away from home with the house chef.,418,N/A,,130 min,N/A,movie
tt7926824,,,,,,,,,,,,,,,,,
tt6016672,Mirza Juuliet,2017,07-Apr-17,"Darshan Kumar, Piaa Bajpai, Priyanshu Chatterjee, Swanand Kirkire",Rajesh Ram Singh,"Shanti Bhushan (dialogue), Shanti Bhushan (screenplay and story)",Drama,N/A,5.3,Hindi,"The world is full of fascination and obsessions. Different people have different desires and goals in life. For some its power, for some its money, for some its someone and for some its ...",65,N/A,,130 min,N/A,movie
tt1562859,Golmaal 3,2010,05-Nov-10,"Mithun Chakraborty, Ajay Devgn, Kareena Kapoor Khan, Tusshar Kapoor",Rohit Shetty,"Bunty Rathore (additional dialogue), Yunus Sajawal (screenplay), Sajid (dialogue), Farhad Samji (dialogue)","Action, Comedy, Drama",Eros International,5.4,Hindi,"In Goa, Pritam meets his love Geeta after many years. They decide to get married but the feud between their respective children creates tension in their marriage.","5,882",N/A,50%,155 min,"$1,132,192",movie
tt4338154,Hawaizaada,2015,06-Feb-15,"Naman Jain, Mithun Chakraborty, Krutika Deo, Gaurav Dwivedi",Vibhu Puri,"Saurabh Bhave, Vibhu Puri","Biography, Drama, Fantasy",Reliance Entertainment,5.6,Hindi,"The film which is based on the life on an Indian scientist Shivkar Bapuji Talpade, who is credited to have constructed India's first unmanned plane is the tale of the hardships that he went...","1,283",N/A,,148 min,N/A,movie
tt3590416,Global Baba,2016,11-Mar-16,"Pankaj Tripathi, Sandeepa Dhar, Ravi Kishan, Abhimanyu Singh",Manoj Tiwari,Vishal Vijay Kumar,Thriller,N/A,5.5,Hindi,"A conman finds refuge in becoming a baba and carries out his various criminal activities under the guise. A policeman, a journalist and politicians get entangled in his Web of deceit.",117,N/A,,120 min,N/A,movie
tt4788726,The Unsound,2013,08-Feb-13,"Shadab Khan, Anurita Jha, Sapna Thakur, Tinnu Anand",Alok Shrivastav,Alok Shrivastav,Thriller,N/A,6.1,Hindi,"THE UNSOUND' is a story of Dev Oberoi, who suffers from multiple organic psychotic disorder-a condition that makes his behavior extremely unpredictable and at times even violent. A failed ...",14,N/A,,105 min,N/A,movie
tt1492872,Hide & Seek,2010,12-Mar-10,"Purab Kohli, Arjan Bajwa, Mrinalini Sharma, Ayaz Khan",Shawn Arranha,"Apoorva Lakhia (screenplay), Apoorva Lakhia (story), Suresh Nair (screenplay), Raj Vasant (dialogue)","Drama, Horror, Thriller",N/A,4.2,"Hindi, Marathi, Panjabi, English",Five former friends are abducted and held in a locked mall by a person dressed as Santa Claus.,145,N/A,,105 min,N/A,movie
tt2073070,Saheb Biwi Aur Gangster,2011,23-Sep-11,"Randeep Hooda, Mahie Gill, Jimmy Shergill, Shreya Narayan",Tigmanshu Dhulia,"Sanjay Chauhan, Tigmanshu Dhulia","Action, Crime, Drama",N/A,7.2,"Hindi, English","Hired to kill a nobleman, the assassin instead falls for the former's unstable wife.","3,270",N/A,,118 min,N/A,movie
tt3483712,Raja Natwarlal,2014,29-Aug-14,"Yugesh Anil, Mohammed Zeeshan Ayyub, Vishwanath Chatterjee, Tarun Dudeja",Kunal Deshmukh,"Parveez Sheikh (story and screenplay), Sanjay Masoomm (dialogue)","Crime, Drama, Thriller",UTV Communications,6.1,Hindi,A small-time con man seeks assistance from his mentor with the intention of settling scores with a gangster.,"3,327",N/A,,141 min,N/A,movie
tt1395025,Agent Vinod,2012,23-Mar-12,"Saif Ali Khan, Kareena Kapoor Khan, Adil Hussain, Rajat Kapoor",Sriram Raghavan,"Arijit Biswas (story), Sriram Raghavan (story)","Action, Adventure",Eros International,5.1,Hindi,A series of seemingly unconnected events across the world leads to Agent Vinod undertaking a globe-trotting mission to discover why his colleague was murdered.,"6,134",N/A,45%,157 min,"$632,446",movie
tt3469244,Phantom,2015,28-Aug-15,"Saif Ali Khan, Katrina Kaif, Sabyasachi Chakraborty, Rajesh Tailang",Kabir Khan,"Hussain Zaidi (story), Kabir Khan (screenplay), Parveez Sheikh (screenplay), Kabir Khan (dialogue), Kausar Munir (dialogue)","Action, Drama, Thriller",N/A,5.7,Hindi,A disgraced Indian soldier carries out a series of assassinations in the hope of restoring his honour.,"7,077",N/A,,136 min,N/A,movie
tt2275802,Satyagraha,2013,30-Aug-13,"Amitabh Bachchan, Kareena Kapoor Khan, Ajay Devgn, Arjun Rampal",Prakash Jha,"Ram Goutam (script supervisor), Prakash Jha, Anjum Rajabali",Drama,UTV,6,Hindi,A corporate go-getter sees his priorities shift when a personal tragedy brings him face-to-face with political corruption.,"4,287",N/A,,152 min,"$738,525",movie
tt1309561,Lamhaa: The Untold Story of Kashmir,2010,16-Jul-10,"Naushaad Abbas, Alisha, Asif Basra, Bipasha Basu",Rahul Dholakia,"Ashwath Bhatt (dialogue), Raaghav Dar (screenplay), Rahul Dholakia (screenplay), Sai Kabir (dialogue), Sayeed Qadri (lyrics), Amitabh Verma (lyrics)","Action, Drama, Thriller",Viva Entertainment,5,Hindi,Indian Military Intelligence deputes an agent to Kashmir incognito to find out who is behind extremist attacks.,539,N/A,,152 min,N/A,movie
tt2395207,Feast of Varanasi,2016,11-Mar-16,"Adil Hussain, Holly Gilbert, Tannishtha Chatterjee, Judi Bowker",Rajan Kumar Patel,Rajan Kumar Patel,"Crime, Drama, Thriller",Raafilms,8.7,"English, Hindi",A young english teacher with a troubled past arrives in the ancient city of Varanasi to spend a few weeks with her aunt who works at an old missionary. it follows the recent suicide of her ...,7,N/A,,97 min,N/A,movie
tt2857500,Saare Jahaan Se Mehnga...,2013,08-Mar-13,"Vishwa S. Badola, Ranjan Chhabra, Zakir Hussain, Sanjay Mishra",Anshul Sharma,"Vijay Manral, Roopesh Thapliyal, Rupesh Thapliyal","Comedy, Drama",TheMovieKaka,7.2,Hindi,A satire on inflation-hit middle-class Indian family from a small city in North India. The story revolves around our protagonist who is struggling to survive in this spiraling inflation and...,671,N/A,,120 min,N/A,movie
tt1877691,Love Breakups Zindagi,2011,07-Oct-11,"Zayed Khan, Dia Mirza, Cyrus Sahukar, Tisca Chopra",Sahil Sangha,"Sanyukta Shaikh Chawla (additional screenplay & dialogue), Sanyukta Shaikh Chawla (screenplay), Sahil Sangha","Comedy, Drama, Romance",Born Free Entertainment,5.8,"Hindi, Panjabi, English",A couple and many of their friends experience changes and challenges in their respective lives after attending a wedding.,853,N/A,,156 min,N/A,movie
tt6201292,Bairavaa,2017,13-Jan-17,"Joseph Vijay, Keerthi Suresh, Jagapathi Babu, Daniel Balaji",Bharathan,Bharathan,Action,N/A,6.3,"Tamil, Hindi, Telugu","Bairavaa, a gallant debt collector, takes on a violent criminal masquerading as a philanthropist in the education field.","6,052",N/A,,169 min,N/A,movie
tt2389974,Aatma,2013,22-Mar-13,"Jaideep Ahlawat, Bipasha Basu, Padam Bhola, Doyel Dhawan",Suparn Verma,"Sudarshana Dwivedi (dialogue), Suparn Verma (dialogue), Suparn Verma (story and screenplay), Suparn Verma","Drama, Horror, Thriller",TheMovieKaka,3.7,Hindi,A single mother fights against the supernatural in order to hold on to her daughter.,492,N/A,,94 min,N/A,movie
tt2777548,Gang of Gardulle,2013,01-Jan-13,"Kader Khan, Akhilendra Mishra, Murli Sharma, Nawazuddin Siddiqui",N/A,N/A,Drama,N/A,5.2,Hindi,N/A,9,N/A,,N/A,N/A,movie
tt1807978,Bhoot and Friends,2010,31-Dec-10,"Ashish Kattar, Aditya Lakhia, Akash Nair, Ishita Panchal",Karanjeet Saluja,"Reshma A. Dev, Sachindra Sharma (dialogues)","Animation, Action, Adventure",N/A,5.1,"Hindi, English","Four holidaying children go missing, then encounter a ghost and hoodlums in a dense forest.",38,N/A,,133 min,N/A,movie
tt2215163,Issaq,2013,26-Jul-13,"Prateik, Amyra Dastur, Ravi Kishan, Prashant Narayanan",Manish Tiwary,"Pawan Sony, Padmaja Thakore, Manish Tiwary",Drama,N/A,4.5,Hindi,"A contemporary adaptation of Romeo and Juliet set in the backdrop of Varanasi in the UP heartland, complete with naxalism, sand mining mafia and of course the timeless love story.",350,N/A,,148 min,N/A,movie
tt4334260,San' 75 (Pachattar),2016,01-Aug-16,"Pravessh Rana, Kay Kay Menon, Kirti Kulhari, Tom Alter",Navneet Behal,"Maitrey Bajpai (dialogue), Maitrey Bajpai (screenplay), Maitrey Bajpai (story), Ramiz Ilham Khan (story,  screenplay & dialogue)",Thriller,N/A,7,Hindi,"In 1975, India was declared in a state of emergency. This movie tells a story of that year and how the first mobile phone arrived to India.",10,N/A,,152 min,N/A,movie
tt2914056,Desi Magic,2016,N/A,"Lillete Dubey, Ameesha Patel, Zayed Khan, Ravi Kishan",Mehul Atha,"Ameet Mehta (dialogue), Ameet Mehta (screenplay), Kuunal Goomer (concept)","Comedy, Romance",N/A,N/A,Hindi,N/A,N/A,N/A,,N/A,N/A,movie
tt4287778,Night,2017,14-Jul-17,"Ashish Bisht, Simon Frenay, Areesz Ganddi, Gaurav Nanda",Onir,"Merle Kröger, Onir, Adhiraj Singh","Drama, Romance",Anticlock Films,4.7,"Hindi, English, Bengali","""Shab"" is a story that revolves around multiple characters' search for happiness and love in a complex, unforgiving, and cold city.",139,N/A,40%,108 min,N/A,movie
tt1667838,I Hate Luv Storys,2010,02-Jul-10,"Imran Khan, Sonam Kapoor, Sammir Dattani, Samir Soni",Punit Malhotra,"Punit Malhotra (story, screenplay & dialogue)","Comedy, Drama, Romance",UTV Communications,5.6,Hindi,"Jay doesn't believe in love Stories, and Simran, is a girl who's in love with the idea of Love itself.","6,434",N/A,,129 min,"$847,993",movie
tt2354407,Teri Meri Kahaani,2012,22-Jun-12,"Shahid Kapoor, Priyanka Chopra, Prachi Desai, Neha Sharma",Kunal Kohli,"Surabhi Bhatnagar (screenplay based on an original story), Surabhi Bhatnagar, Robin Bhatt (screenplay), Kunal Kohli (story & screenplay)","Comedy, Drama, Romance",Eros Entertainment,4.8,Hindi,"The true love between a couple in 1910, 1960 and 2012. Their love is so strong that even destiny wants to bring them together.","3,381",N/A,,117 min,N/A,movie
tt4493550,Flat 211,2017,02-Jun-17,"Jayesh Raj, Sonal Singh, Samonica Shrivastava, Digvijay Singh",Sunil Sanjan,"Sunil Sanjan (screenplay), Sunil Sanjan (story), Ravi Kaiwart (story), Sunil Sanjan (dialogue), Ravi Kaiwart (dialogue)","Crime, Mystery, Thriller",N/A,N/A,Hindi,An incident occurs at Flat 211 and the characters connected to this flat get involved in the incident leading to a mess. The mysterious identity of the person responsible for the incident grows leading to a dramatic turn of events.,N/A,N/A,,N/A,N/A,movie
tt3129282,War Chhod Na Yaar,2013,11-Oct-13,"Sharman Joshi, Soha Ali Khan, Javed Jaffrey, Sanjay Mishra",Faraz Haider,"Faraz Haider, Deepak Kingrani (dialogue)","Comedy, War",Alerion Films,5.6,"Hindi, Urdu","It is M*A*S*H comes to India and meets bollywood. A situational/satirical comedy, full of funny dialogues and tries to show a new side of war. Starring Javed Jafferi and Sharman Joshi in ...",759,N/A,,119 min,N/A,movie
tt1890363,Buddha in a Traffic Jam,2016,13-May-16,"Aanchal Dwivedi, Mahie Gill, Pallavi Joshi, Anupam Kher",Vivek Agnihotri,"Vivek Agnihotri, Vivek Agnihotri (story), Rohit Malhotra, Rohit Malhotra","Crime, News, Thriller",Friday Night Productions,7,"Hindi, English",Vikram Pandit (Arunoday Singh) a student of the Indian Institute of Business becomes the blue-eyed boy of Professor Jamshed Batki (Anupam Kher). Under Batki's influence Vikram starts public...,"1,220",N/A,,114 min,N/A,movie
tt1773109,Yamla Pagla Deewana,2011,14-Jan-11,"Nafisa Ali, Yugesh Anil, Madhuri Bhattacharya, Emma Brown Garett",Samir Karnik,"Jasvinder Bath (story), Jasvinder Bath","Action, Comedy, Drama",Eros International,5.7,"Hindi, Panjabi",A married Canadian travels to India to re-unite with his estranged father and brother but faces obstacles and challenges.,"3,283",N/A,,163 min,N/A,movie
tt2401719,Prague,2013,27-Sep-13,"Chandan Roy Sanyal, Arfi Lamba, Kumar Mayank, Sonia Bindra",Ashish R. Shukla,"Rohit Khaitan (conceived by), Akshendra Mishra (additional screenplay), Sumit Saxena (screenplay), Ashish R. Shukla (screenplay), Ashish R. Shukla (story), Vijay Verma (additional screenplay)","Mystery, Romance, Thriller",N/A,5.9,"Hindi, English, Czech","A psychological thriller about an upcoming architect's tryst with the city, a girl he meets there, friends who follow him from India and his past which continuously controls his present and eventually shapes his fate.",296,N/A,,109 min,N/A,movie
tt3382148,Yaariyan,2014,10-Jan-14,"Himansh Kohli, Vikas Verma, Ashish Bhatia, Vivek Bhatnagar",Divya Khosla Kumar,N/A,"Drama, Romance",N/A,2.7,Hindi,A college student must win an inter college competition to save his college from being demolished by property builders.,"2,665",N/A,,145 min,N/A,movie
tt7791496,,,,,,,,,,,,,,,,,
tt2951576,One by Two,2014,31-Jan-14,"Abhay Deol, Preeti Desai, Lillete Dubey, Rati Agnihotri",Devika Bhagat,"Devika Bhagat (dialogue), Devika Bhagat (story and screenplay), Manoj Tapadia (dialogue)","Comedy, Drama, Romance",N/A,4.1,"Hindi, English",Aspiring musician Amit and dance fanatic Samara get a better insight of what life has in store for them.,630,N/A,,139 min,N/A,movie
tt3531604,Gang of Ghosts,2014,21-Mar-14,"Sharman Joshi, Mahie Gill, Asrani, Lankesh Bhardwaj",Satish Kaushik,N/A,"Comedy, Drama",N/A,3.6,Hindi,A story about a group of ghosts who have lost their shelter due to urbanization. The story starts with a struggling wannabe director who somehow crosses paths with a stranger. The stranger ...,269,N/A,,128 min,N/A,movie
tt2357926,Ramaiya Vastavaiya,2013,19-Jul-13,"Shruti Haasan, Girish Taurani, Randhir Kapoor, Sonu Sood",Prabhudheva,"Shiraz Ahmed (screenplay and dialogue), Veeru Potla (story)","Comedy, Drama, Romance",Reliance Big Entertainment,5.7,Hindi,"Ram falls in love with Sona, who lives on the fields of Punjab. He follows her to her farm, where her elder brother challenges him to produce more seed on their fields. If he wins, he will be allowed to marry her.","2,771",N/A,,148 min,N/A,movie
tt5756052,Jeena Isi Ka Naam Hai,2017,03-Mar-17,"Arbaaz Khan, Himansh Kohli, Ashutosh Rana, Manjari Phadnis",Keshhav Panneriy,"Purnima Mead (based on premise by), Amreetaa Roy (dialogue), Amreetaa Roy (screenplay)",Drama,Grand Showbiz Media & Entertainment,5.5,Hindi,"A bollywood entertainer with universal issues directed by Keshhav Panneriy, this movie stars Arbaaz Khan, Ashutosh Rana, Himansh Kohli, Manjari Phadnis and Prem Chopra.",64,N/A,,173 min,N/A,movie
tt1720254,Thank You,2011,08-Apr-11,"Akshay Kumar, Bobby Deol, Sonam Kapoor, Sunil Shetty",Anees Bazmee,"Rajan Aggarwal (screenplay co-writer), Ikram Akhtar (screen play), Nisar Akhtar, Anees Bazmee, Amitabh Bhattacharya (lyrics), Kumaar (lyrics), Ashiesh Pandit (lyrics)",Comedy,UTV Communications,4.7,"Hindi, Panjabi",Three wives engage the services of a private investigator after they suspect their respective husbands of infidelity.,"4,250",N/A,,125 min,"$462,609",movie
tt5784852,Tera Intezaar,2017,01-Dec-17,"Arbaaz Khan, Sunny Leone, Bhani Singh, Salil Ankola",Raajeev Walia,Anwarullah Khan,"Romance, Thriller",N/A,3,Hindi,A woman sets out to uncover how her lover went missing.,81,N/A,,108 min,N/A,movie
tt2939912,Traffic,2016,06-May-16,"Jimmy Shergill, Manoj Bajpayee, Divya Dutta, Parambrata Chatterjee",Rajesh Pillai,"Sanjay (story), Bobby (story), Suresh Nair (screenplay), Piyush Mishra (dialogue), Prashant Pandey (dialogue)","Adventure, Drama, Thriller",N/A,6.7,Hindi,An emotional thriller based on a road trip from Mumbai to Pune. Inspired from the real events that happened in Chennai,"2,049",N/A,,104 min,N/A,movie
tt2679480,Sulemani Keeda,2014,05-Dec-14,"Naveen Kasturia, Mayank Tewari, Aditi Vasudev, Karan Mirchandani",Amit Masurkar,Amit Masurkar,"Comedy, Romance",N/A,7.2,Hindi,"This is a Bromantic Comedy about two struggling writers who peddle their mediocre screenplay, ""Sulemani Keeda"" in Bollywood. Perenially hungry and horny, they lie, drink, hit on ...","2,337",N/A,,89 min,N/A,movie
tt5182656,Khamosh Adalat Jaari Hai,2017,14-Mar-17,"Nandita Das, Pravina Bhagwat Deshpande, Ajitesh Gupta, Yusuf Hussain",Ritesh Menon,Vijay Tendulkar,Drama,N/A,8.5,Hindi,"A mock trial during the rehearsal of a play quickly turns into a gripping drama about desire, gender issues, power and control, this is an adaptation of playwright Vijay Tendulkar's Shantata. Court Chalu Aahe (1963).",8,N/A,,100 min,N/A,movie
tt1447508,Peepli (Live),2010,13-Aug-10,"Omkar Das Manikpuri, Raghuvir Yadav, Shalini Vatsa, Farrukh Jaffar","Anusha Rizvi, Mahmood Farooqui(co-director)","Bhadwai (lyrics), Swanand Kirkire (lyrics), Noon Meem Rashet (lyrics), Anusha Rizvi (screenplay), Gangaram Sakhet (lyrics), Sanjeev Sharma (lyrics)","Comedy, Drama",UTV Communications,7.5,"Hindi, English",An impoverished farmer's threat to end his life invites attention from politicians and media.,"10,169",69,85%,95 min,"$748,128",movie
tt2361148,Club 60,2013,06-Dec-13,"Farooq Shaikh, Sarika, Raghuvir Yadav, Satish Shah",Sanjay Tripathy,Sanjay Tripathy,Drama,N/A,7.3,Hindi,"A glance at 62 years old Manu bhai Shah (Raghubir Yadav) and how he appears peculiar in his outfit, crazy in his behavior, flamboyant in his style, loud and funny in his conversation and ...",338,N/A,,137 min,N/A,movie
tt2317135,Tamanchey: Pyar Mein Dil Pe Maar De Goli,2014,10-Oct-14,"Nikhil Dwivedi, Richa Chadha, Damandeep Singh, Vijay Pande",Navneet Behal,N/A,"Crime, Romance",N/A,4.7,Hindi,"An aggressive, passionate acidic love story between two criminals whilst on the run from the law.",220,N/A,,113 min,N/A,movie
tt2848824,Bajatey Raho,2013,26-Jul-13,"Tusshar Kapoor, Vinay Pathak, Ranvir Shorey, Vishakha Singh",Shashant Shah,"Zafar Khan (story and screenplay), Akshay Verma (dialogue)","Comedy, Drama, Thriller",Eros Entertainment,5.3,Hindi,Surviving family members and friends of a man who was conned by the cunning businessman Sabbarwahl string together a series of their own cons in an attempt to bring him down.,652,N/A,,110 min,N/A,movie
tt3045946,Tara: The Journey of Love and Passion,2013,12-Jul-13,"Rekha Rana, Ashish Saleem, Brijesh Kori, Sapna Choubisa","Raj Kumar, Kumar Raj, Mohan Raney","Prof. Kishan Kumar Pawar (story), Prof. Kishan Kumar Pawar",Drama,N/A,5.7,Hindi,It's a saga of an illiterate illegal brewer- an Indian gypsy Woman- who is outlawed from her house and hamlet by her husband Allegedly for adultery when she is already nine months pregnant....,26,N/A,,110 min,N/A,movie
tt4659548,Rebellious Flower,2016,15-Jan-16,"Prince Shah, Shashank Singh, Mantra, Shaneel Sinha",Krishan Hooda,Jagdish Bharti,"Biography, Drama",N/A,7.2,Hindi,The film on the life of guru Osho Rajneesh and his spiritual journey to enlightenment.,154,N/A,,109 min,N/A,movie
tt3776484,Zubaan,2015,04-Mar-16,"Raaghav Chanana, Manish Chaudhary, Sarah-Jane Dias, Abhimanyu Garg",Mozez Singh,"Sumit Roy (screenplay), Mozez Singh, Thani (screenplay)",Drama,N/A,6.4,"Hindi, English, Panjabi","A young boy wants to become a big shot but after seeing the bad things involved he instead chooses to pursue his passion that is singing, similar to his father.",150,N/A,,115 min,N/A,movie
tt6642396,Jattu Engineer,2017,19-May-17,"Amardeep Insan, Ashok Insan, Divya Insan, Ishwar Insan","Honeypreet Insan, Gurmeet Ram Rahim Singh","Gurmeet Ram Rahim Singh (Dialougue Writer), Gurmeet Ram Rahim Singh (Screenplay Writer), Gurmeet Ram Rahim Singh (script writer)","Comedy, Crime, Drama",Hakikat Entertainment,6.5,Hindi,"A teacher works hard to better a village that has poverty, unemployment, and a drug problem.","3,238",N/A,,139 min,N/A,movie
tt1740092,Chitkabrey,2011,26-Aug-11,"Ravi Kishan, Rahul Singh, Rajesh Shringarpore, Ssanjay Swaraaj",Suneet Arora,"Suneet Arora (screenplay), Vishal Vijay Kumar (screenplay), Sanjay Masoom (dialogue), Sanjay Masoom (screenplay)","Drama, Mystery, Thriller",N/A,4.1,"Hindi, Bengali, Gujarati, Panjabi, Urdu, English",A group of former collegians are confined by a victim they had ragged 15 years ago.,123,N/A,,120 min,N/A,movie
tt1656171,Dam999,2011,25-Nov-11,"Vinay Rai, Joshua Fredric Smith, Megha Burman, Linda Arsenio",Sohan Roy,"Sohan Roy, Rob Tobin (contributing writer)","Adventure, Drama, Sci-Fi",N/A,3.7,"English, Hindi, Malayalam","After many years two mariners return to homeland with the hope of a new beginning, little did they know about a disaster that would change their destiny.",863,N/A,,108 min,N/A,movie
tt1725795,7 Aum Arivu,2011,26-Oct-11,"Suriya, Shruti Haasan, Johnny Nguyen, Abhinaya",A.R. Murugadoss,A.R. Murugadoss,"Action, Sci-Fi, Thriller",Viva,6,"Tamil, Hindi, Telugu",A genetic engineering student tries to bring back the skills of a legend of the past and use his skills to save India from a deadly virus attack by China.,"7,923",N/A,,160 min,N/A,movie
tt1388903,Mirch,2010,22-Oct-10,"Arunoday Singh, Boman Irani, Ila Arun, Konkona Sen Sharma",Vinay Shukla,"Javed Akhtar (lyrics), Vinay Shukla (story)","Comedy, Drama, Fantasy",N/A,6.6,"Hindi, Rajasthani, Sindhi, English",A story-writer attempts to convince a producer to accept four erotic stories from the Panchtantra.,738,N/A,,105 min,N/A,movie
tt1740670,Dus Tola,2010,22-Oct-10,"Manoj Bajpayee, Aarti Chhabria, Dilip Prabhavalkar, Govind Namdeo",Ajay Varma,"Raghunath Paleri (story and screenplay), Sunil Saigal (dialogues)","Comedy, Drama",BIGFlix,7,Hindi,A Village goldsmith gets betrayed by the woman he loves.,255,N/A,,120 min,N/A,movie
tt4826742,Chidiya,2015,N/A,"Svar Kamble, Ayush Pathak, Vinay Pathak, Amruta Subhash",Mehran Amrohi,"Mehran Amrohi (story), Amitabh Verma (screenplay), Mehran Amrohi (screenplay), Mehran Amrohi (dialogue), Ganesh Pandit (dialogue), Ambar Hadap (dialogue)",Drama,N/A,N/A,Hindi,"The film is moving around the story of two kids aged 9 and 10, their dreams and the flight of their imaginations. Vinay Pathak is playing the role of their uncle who helps them to achieve ...",N/A,N/A,,110 min,N/A,movie
tt2130242,Tere Naal Love Ho Gaya,2012,24-Feb-12,"Riteish Deshmukh, Genelia D'Souza, Om Puri, Tinnu Anand",Mandeep Kumar,"Abhijeet Sandhu, Dhieyo Sandhu","Comedy, Drama, Romance",UTV Motion Pictures,5.8,Hindi,"A boy kidnaps a girl, but starts to fall in love with her.","3,469",N/A,,130 min,"$177,472",movie
tt2389486,Mai,2013,01-Feb-13,"Asha Bhosle, Kshitee Jog, Shivani Joshi, Ram Kapoor",Mahesh Kodiyal,"Mahesh Kodiyal, Sahil Sultanpuri (song), Manoj Tapadia","Drama, Family",N/A,7,Hindi,The only son who she had great expectations from isolates her the moment he lands a job in a foreign country. The 2 youngest daughters try to run away from the responsibility too. The ...,83,N/A,,105 min,N/A,movie
tt1285245,Lahore,2010,19-Mar-10,"Farooq Shaikh, Nafisa Ali, Aanaahad, Sabyasachi Chakraborty",Sanjay Puransingh Chauhan,"Sanjay Puran Singh Chauhan (dialogue), Sanjay Puran Singh Chauhan (screenplay), Sanjay Puransingh Chauhan (story), Panchhi Jalonvi (lyrics), Hriday Lani (collaborating writer), Piyush Mishra (dialogue), Piyush Mishra (screenplay), Junaid Wasi (lyrics)","Action, Drama, Sport",N/A,6.4,"Hindi, English, Urdu",A cricketer turns kick-boxer in order to avenge the death of his brother.,481,N/A,,145 min,N/A,movie
tt3005850,Sooper Se Ooper,2013,25-Oct-13,"Tinnu Anand, Mahesh Balraj, Mithilesh Chaturvedi, Vir Das",Shekhar Ghosh,Shekhar Ghosh,Comedy,N/A,4.4,Hindi,A city guy goes to rural Rajasthan to look for his uncle.,150,N/A,,N/A,N/A,movie
tt5460016,ISIS,2017,23-Jun-17,"Amrityan, Moshin Bhat, Snighdadeep Chatterji, Rahul Dev",Yuvraj Kumar,Yuvraj Kumar,Action,N/A,8.5,Hindi,"Exposes the Commanders of an ISIS camp , who Indoctrinate the youth for acts of violence.",10,N/A,,92 min,N/A,movie
tt6587216,Alex's Strip,2018,N/A,N/A,Irene Zoe Alameda,Irene Zoe Alameda,Drama,N/A,N/A,"English, Spanish, Hindi","A teenager is reunited with her father, a Spanish-Maghrebi merchant who has spent a long time in jail accused of Jihadism by mistake. She accompanies him on a business trip to Jaisalmer (India), where they are involved in a terrorist plot.",N/A,N/A,,N/A,N/A,movie
tt5216810,Bollywood Diaries,2016,26-Feb-16,"Raima Sen, Salim Diwan, Ashish Vidyarthi, Karuna Pandey",K.D. Satyam,"K.D. Satyam (dialogue), K.D. Satyam (screenplay), K.D. Satyam (story), Anand V.R.S. Tomar (dialogue)",Drama,Rehab Pictures Pvt Ltd,5.9,Hindi,The passionate journey of three Bollywood fanatics who wish to make it big in the industry.,211,N/A,,123 min,N/A,movie
tt3607198,Punjab 1984,2014,27-Jun-14,"Diljit Dosanjh, Kiron Kher, Pavan Malhotra, Sonam Bajwa",Anurag Singh,"Surmeet Maavi, Anurag Singh (story), Anurag Singh, Anurag Singh","Drama, Family, History",N/A,8.5,"Panjabi, Hindi",Story of a mother and her search for her missing son,"1,510",N/A,,159 min,"$138,545",movie
